{
  "$schema": "https://json-schema.org/draft/2020-12/schema",
  "$id": "https://reviewgate.lvtd.dev/schemas/reviewgate-review-output-v3.schema.json",
  "title": "ReviewGate Review Output v3",
  "type": "object",
  "allOf": [
    {
      "if": {
        "properties": { "status": { "const": "review_error" } },
        "required": ["status"]
      },
      "then": {
        "properties": {
          "score": { "type": "null" },
          "angle_errors": { "type": "array", "minItems": 1 }
        },
        "required": ["angle_errors"]
      },
      "else": {
        "properties": {
          "score": { "type": "integer", "minimum": 0, "maximum": 5 },
          "angle_errors": { "type": "array", "maxItems": 0 }
        }
      }
    }
  ],
  "required": [
    "score",
    "reviewed_sha",
    "status",
    "verdict",
    "models",
    "findings",
    "notes"
  ],
  "additionalProperties": false,
  "properties": {
    "score": {
      "type": ["integer", "null"],
      "minimum": 0,
      "maximum": 5,
      "description": "Derived from validated findings for completed reviews; null for review_error."
    },
    "reviewed_sha": { "type": "string", "minLength": 1 },
    "status": {
      "type": "string",
      "enum": ["passed", "needs_changes", "review_error"]
    },
    "verdict": {
      "type": "string",
      "minLength": 1,
      "description": "Concise overall verdict. Do not introduce concrete defects here unless they also appear as findings."
    },
    "models": {
      "type": "array",
      "items": { "type": "string", "minLength": 1 }
    },
    "estimated_cost_usd": { "type": ["number", "null"], "minimum": 0 },
    "cost_summary": {
      "type": ["object", "null"],
      "additionalProperties": false,
      "required": ["current_run_usd", "components"],
      "properties": {
        "current_run_usd": { "type": "number", "minimum": 0 },
        "source": {
          "type": ["string", "null"],
          "enum": ["open_router_usage", "fallback_pricing", "unknown", null]
        },
        "components": {
          "type": "array",
          "items": { "$ref": "#/$defs/cost_component" }
        }
      }
    },
    "metrics": {
      "type": ["object", "null"],
      "additionalProperties": false,
      "required": [
        "finding_count",
        "blocking_finding_count",
        "inline_eligible_count",
        "p0_count",
        "p1_count",
        "p2_count",
        "p3_count",
        "p4_count",
        "cost_source"
      ],
      "properties": {
        "finding_count": { "type": "integer", "minimum": 0 },
        "blocking_finding_count": { "type": "integer", "minimum": 0 },
        "inline_eligible_count": { "type": "integer", "minimum": 0 },
        "p0_count": { "type": "integer", "minimum": 0 },
        "p1_count": { "type": "integer", "minimum": 0 },
        "p2_count": { "type": "integer", "minimum": 0 },
        "p3_count": { "type": "integer", "minimum": 0 },
        "p4_count": { "type": "integer", "minimum": 0 },
        "analyzed_line_count": {
          "type": ["integer", "null"],
          "minimum": 0,
          "description": "Number of added and deleted diff lines ReviewGate included as changed code for this report. ReviewGate may recompute this value from local diff context."
        },
        "current_run_cost_usd": { "type": ["number", "null"], "minimum": 0 },
        "cost_source": {
          "type": "string",
          "enum": ["open_router_usage", "fallback_pricing", "unknown"]
        }
      }
    },
    "review_stages": {
      "type": "array",
      "items": { "$ref": "#/$defs/review_stage" }
    },
    "angle_results": {
      "type": "array",
      "items": { "$ref": "#/$defs/review_angle_result" },
      "description": "Successfully completed per-angle review outcomes. Failed angles are recorded separately in angle_errors and never contribute a numeric score."
    },
    "angle_errors": {
      "type": "array",
      "items": { "$ref": "#/$defs/review_angle_error" },
      "description": "Typed reviewer failures. A non-empty value makes the top-level status review_error and score null."
    },
    "findings": {
      "type": "array",
      "items": { "$ref": "#/$defs/finding" }
    },
    "disposition_updates": {
      "type": "array",
      "items": { "$ref": "#/$defs/disposition_update" },
      "description": "Validated convergence transitions that summary publication must apply to the prior canonical finding state."
    },
    "tracked_findings": {
      "type": "array",
      "items": { "$ref": "#/$defs/tracked_finding" },
      "description": "Canonical semantic finding state, including settled findings and bounded disposition history."
    },
    "notes": {
      "type": "array",
      "items": { "type": "string" }
    }
  },
  "$defs": {
    "disposition_record": {
      "type": "object",
      "required": [
        "disposition",
        "evidence_summary",
        "actor",
        "reviewed_sha",
        "code_fingerprint"
      ],
      "additionalProperties": false,
      "properties": {
        "disposition": {
          "type": "string",
          "enum": [
            "fixed",
            "still_open",
            "rejected_with_evidence",
            "intentional_contract",
            "disputed",
            "superseded"
          ]
        },
        "submitted_disposition": {
          "type": "string",
          "enum": [
            "accepted",
            "fixed",
            "rejected_with_evidence",
            "already_implemented",
            "intentional_contract",
            "needs_human"
          ]
        },
        "evidence_summary": { "type": "string", "minLength": 1 },
        "actor": { "type": "string", "minLength": 1 },
        "reviewed_sha": { "type": "string", "minLength": 1 },
        "code_fingerprint": { "type": "string", "minLength": 1 }
      }
    },
    "tracked_finding": {
      "type": "object",
      "required": [
        "semantic_fingerprint",
        "finding",
        "disposition",
        "disposition_history"
      ],
      "additionalProperties": false,
      "properties": {
        "semantic_fingerprint": { "type": "string", "minLength": 1 },
        "finding": { "$ref": "#/$defs/finding" },
        "disposition": {
          "type": "string",
          "enum": [
            "fixed",
            "still_open",
            "rejected_with_evidence",
            "intentional_contract",
            "disputed",
            "superseded"
          ]
        },
        "disposition_history": {
          "type": "array",
          "minItems": 1,
          "items": { "$ref": "#/$defs/disposition_record" }
        }
      }
    },
    "disposition_update": {
      "type": "object",
      "required": [
        "semantic_fingerprint",
        "disposition",
        "evidence_summary",
        "actor",
        "reviewed_sha",
        "code_fingerprint",
        "resolution"
      ],
      "additionalProperties": false,
      "properties": {
        "semantic_fingerprint": { "type": "string", "minLength": 1 },
        "disposition": {
          "type": "string",
          "enum": [
            "fixed",
            "still_open",
            "rejected_with_evidence",
            "intentional_contract",
            "disputed",
            "superseded"
          ]
        },
        "evidence_summary": { "type": "string", "minLength": 1 },
        "actor": { "type": "string", "minLength": 1 },
        "reviewed_sha": { "type": "string", "minLength": 1 },
        "code_fingerprint": { "type": "string", "minLength": 1 },
        "resolution": {
          "$ref": "#/$defs/finding",
          "description": "The grounded resolution candidate revalidated against the repository and convergence delta before publication."
        }
      }
    },
    "cost_component": {
      "type": "object",
      "required": ["label", "model", "estimated_cost_usd"],
      "additionalProperties": false,
      "properties": {
        "label": { "type": "string", "minLength": 1 },
        "model": { "type": "string", "minLength": 1 },
        "prompt_tokens": { "type": ["integer", "null"], "minimum": 0 },
        "completion_tokens": { "type": ["integer", "null"], "minimum": 0 },
        "estimated_cost_usd": { "type": "number", "minimum": 0 }
      }
    },
    "review_stage": {
      "type": "object",
      "required": ["name", "model", "status", "reason", "estimated_cost_usd"],
      "additionalProperties": false,
      "properties": {
        "name": { "type": "string", "minLength": 1 },
        "model": { "type": "string", "minLength": 1 },
        "status": { "type": "string", "minLength": 1 },
        "reason": { "type": "string", "minLength": 1 },
        "estimated_cost_usd": { "type": ["number", "null"], "minimum": 0 }
      }
    },
    "review_angle_result": {
      "type": "object",
      "required": ["id", "name", "score", "status", "verdict", "model", "finding_ids"],
      "additionalProperties": false,
      "properties": {
        "id": { "type": "string", "minLength": 1 },
        "name": { "type": "string", "minLength": 1 },
        "score": {
          "type": "integer",
          "minimum": 0,
          "maximum": 5,
          "description": "Derived from the findings referenced by finding_ids."
        },
        "status": {
          "type": "string",
          "enum": ["passed", "needs_changes"]
        },
        "verdict": { "type": "string", "minLength": 1 },
        "model": { "type": "string", "minLength": 1 },
        "finding_ids": {
          "type": "array",
          "items": { "type": "string", "minLength": 1 }
        }
      }
    },
    "review_angle_error": {
      "type": "object",
      "required": ["angle_id", "angle_name", "kind", "retryable", "message", "model"],
      "additionalProperties": false,
      "properties": {
        "angle_id": { "type": "string", "minLength": 1 },
        "angle_name": { "type": "string", "minLength": 1 },
        "kind": {
          "type": "string",
          "enum": ["timeout", "malformed_response", "empty_response", "provider_error", "transport_error"]
        },
        "retryable": { "type": "boolean" },
        "message": {
          "type": "string",
          "minLength": 1,
          "description": "Sanitized reviewer failure summary that does not contain provider response bodies, credentials, or prompt content."
        },
        "model": { "type": "string", "minLength": 1 }
      }
    },
    "finding": {
      "type": "object",
      "required": [
        "id",
        "scope",
        "severity",
        "confidence",
        "classification",
        "evidence_gate_result",
        "blocking_reason",
        "file",
        "line",
        "title",
        "detail",
        "agent_instruction"
      ],
      "additionalProperties": false,
      "properties": {
        "id": { "type": "string", "minLength": 1 },
        "angle_id": {
          "type": ["string", "null"],
          "description": "Review angle that produced this finding, such as general or adversarial."
        },
        "scope": {
          "type": "string",
          "enum": ["line", "file", "pr"],
          "description": "Use line only for findings that belong to one exact changed line in the new/right side of the diff; use file or pr for broader feedback. Publishing still uses inline PR comments, with fallback right-side diff line anchors when needed."
        },
        "severity": {
          "type": "string",
          "enum": ["P0", "P1", "P2", "P3", "P4"]
        },
        "confidence": { "type": "number", "minimum": 0, "maximum": 1 },
        "classification": {
          "type": "string",
          "enum": ["defect", "security", "reliability_risk", "contract_ambiguity", "suggestion"],
          "description": "Finding kind. Contract ambiguity and suggestion are always advisory."
        },
        "evidence_gate_result": {
          "type": "string",
          "enum": ["passed", "failed", "not_required"],
          "description": "Deterministic evidence-gate result. Only passed findings can block."
        },
        "blocking_reason": {
          "type": ["string", "null"],
          "enum": [
            "validated_defect",
            "validated_security",
            "validated_reliability_risk",
            null
          ],
          "description": "Deterministic reason the finding blocks, or null for advisory findings."
        },
        "grounding": {
          "anyOf": [
            { "$ref": "#/$defs/finding_grounding" },
            { "type": "null" }
          ],
          "description": "Required before a high-confidence P0-P3 defect, security finding, or reliability risk can block. Advisory findings may omit it."
        },
        "file": { "type": ["string", "null"] },
        "line": { "type": ["integer", "null"], "minimum": 1 },
        "title": { "type": "string", "minLength": 1 },
        "detail": { "type": ["string", "null"] },
        "agent_instruction": { "type": "string", "minLength": 1 }
      }
    },
    "finding_grounding": {
      "type": "object",
      "required": [
        "semantic_key",
        "resolution_disposition",
        "resolution_evidence_summary",
        "claim",
        "causal_path",
        "test_assessment",
        "evidence",
        "related_tests",
        "reproduction",
        "proof",
        "novelty_evidence",
        "reopening_evidence"
      ],
      "additionalProperties": false,
      "properties": {
        "semantic_key": {
          "type": "string",
          "minLength": 1,
          "description": "Stable machine-readable root-cause identity. Reuse it across wording and line movement."
        },
        "resolution_disposition": {
          "type": ["string", "null"],
          "enum": ["fixed", null],
          "description": "Set to fixed only when the delta deletes every prior current-head evidence location and the resolution checks every added line in each non-empty replacement block; pure deletions require explicit disposition."
        },
        "resolution_evidence_summary": {
          "type": ["string", "null"],
          "description": "Concise explanation of the current-head evidence proving the prior finding is fixed."
        },
        "claim": { "type": "string", "minLength": 1 },
        "causal_path": {
          "type": "string",
          "minLength": 1,
          "description": "Trace the changed or deleted line through the affected code path to the concrete failure."
        },
        "test_assessment": {
          "type": "string",
          "minLength": 1,
          "description": "What existing tests were inspected and whether they exercise or contradict the alleged path."
        },
        "evidence": {
          "type": "array",
          "minItems": 1,
          "items": { "$ref": "#/$defs/finding_evidence" }
        },
        "related_tests": {
          "type": "array",
          "items": { "$ref": "#/$defs/finding_evidence" }
        },
        "reproduction": { "type": ["string", "null"] },
        "proof": { "type": ["string", "null"] },
        "novelty_evidence": {
          "type": ["string", "null"],
          "description": "For a late new blocker, why it did not exist or could not be detected at the prior reviewed SHA."
        },
        "reopening_evidence": {
          "type": ["string", "null"],
          "description": "For a prior resolved or rejected semantic finding, the relevant code or contract change that justifies reopening."
        }
      }
    },
    "finding_evidence": {
      "type": "object",
      "required": ["path", "side", "line", "excerpt", "reason"],
      "additionalProperties": false,
      "properties": {
        "path": { "type": "string", "minLength": 1 },
        "side": {
          "type": "string",
          "enum": ["new", "old"],
          "description": "Use new for the checked-out head and old only for a deleted line present in the reviewed diff."
        },
        "line": { "type": "integer", "minimum": 1 },
        "excerpt": {
          "type": "string",
          "minLength": 1,
          "description": "The exact full source line, ignoring only leading, trailing, and repeated whitespace."
        },
        "reason": { "type": "string", "minLength": 1 }
      }
    }
  }
}
